{
  "$schema": "./schemas/marketplace.schema.json",
  "name": "agentai-tcap",
  "version": "1.0.0",
  "description": "AgentAI x Transformation Capital — AI-powered tools for deal intelligence",
  "owner": {
    "name": "AgentAI",
    "email": "dev@agentai.app",
    "url": "https://agentai.app"
  },
  "plugins": [
    {
      "name": "hotlist",
      "description": "Hot List Dashboard — enrich, rank, and export portfolio company intelligence",
      "version": "1.0.0",
      "author": { "name": "Zorik Gordon" },
      "source": "./plugins/hotlist",
      "category": "domain",
      "keywords": ["hotlist", "dashboard", "enrichment", "portfolio", "vc"]
    },
    {
      "name": "slides",
      "description": "Create stunning branded presentations — from scratch, outline, or PowerPoint. Zero-dependency HTML output.",
      "version": "1.0.0",
      "author": { "name": "Sacha Brahami" },
      "source": "./plugins/slides",
      "category": "productivity",
      "keywords": ["slides", "presentation", "deck", "powerpoint", "html"]
    },
    {
      "name": "planner",
      "description": "Structured planning workflow — brainstorm ideas, evaluate approaches, produce actionable plans",
      "version": "1.0.0",
      "author": { "name": "Zorik Gordon" },
      "source": "./plugins/planner",
      "category": "productivity",
      "keywords": ["plan", "brainstorm", "strategy", "workflow"]
    },
    {
      "name": "daily-briefing",
      "description": "Morning briefing — calendar, email, Google Chat, action items, and draft responses",
      "version": "1.1.0",
      "author": { "name": "Michael Gorodetsky" },
      "source": "./plugins/daily-briefing",
      "category": "productivity",
      "keywords": ["briefing", "morning", "email", "calendar", "chat", "summary"]
    }
  ]
}
